{
  "$schema": "http://json-schema.org/draft-07/schema#",
  "title": "SPTMM Mod Schema",
  "type": "object",
  "properties": {
    "name": {
      "type": "string",
      "description": "The name of the mod."
    },
    "id": {
      "type": "string",
      "description": "A unique (internal) identifier for the mod."
    },
    "source": {
      "type": "string",
      "description": "The source of the mod (e.g. github).",
      "enum": ["github", "filebase", "google"],
      "default": "github"
    },
    "owner": {
      "type": "string",
      "description": "The name of the Github owner where the mod is hosted."
    },
    "repo": {
      "type": "string",
      "description": "The name of the repository where the mod is hosted."
    },
    "dependencies": {
      "type": "array",
      "items": {
        "type": "object",
        "properties": {
          "id": {
            "type": "string",
            "description": "The identifier for the dependency."
          },
          "load_first": {
            "type": "boolean",
            "description": "Whether the dependency should be loaded first."
          }
        },
        "required": [
          "id"
        ]
      },
      "description": "List of dependencies for the trader."
    }
  },
  "load_after": {
    "type": "array",
    "items": {
      "type": "string"
    },
    "description": "List of mod ids that need to be loaded first.",
    "default": []
  },
  "filebase_url": {
    "type": "string",
    "description": "The filebase download URL for the mod (for mods that don't use github)."
  },
  "google_drive_id": {
    "type": "string",
    "description": "The Google file id for the mod (for mods that don't use github)."
  },
  "required": [
    "name",
    "id"
  ],
  "additionalProperties": false
}
